school_name,unique_id,date,sentences,roberta_compound,place,latitude,longitude,revised_place,revised_latitude,revised_longitude,place_type,false_positive,checked_by
GMU,GMU_43,2025-01-24 08:21:08,"From other countries’ cultures and people to the military’s own social structures (enlisted and commissioned kids had very different backgrounds but we all went to the same schools), when I landed in America for college I was shocked at the de facto economic and racial segregation in our country.",-0.5208045840263367,United States,39.76,-98.5,,,,,,
GMU,GMU_77,2025-01-24 01:20:39,"Around 40% of US employees are hybrid or WFH - same as the federal government, doofus",-0.22959855198860168,United States,39.76,-98.5,,,,,,
GMU,GMU_79,2025-01-24 00:49:14,"I work in the Student DEI office at George Mason, it’s literally just supporting people from different back ground.",0.31885796785354614,George Mason University Fairfax Campus,38.83088,-77.30794,,,,,,
GMU,GMU_80,2025-01-24 00:49:14,I work there because I am a first generation student with high school drop out parents from rural Virginia who didn’t know the first thing about college.,-0.3816240727901459,Virginia,37.54812,-77.44675,,,,,,
GMU,GMU_96,2025-01-24 20:41:36,Like why are white men overrepresented in congress versus the actual US population?,-0.5380246043205261,United States,39.76,-98.5,,,,,,
GMU,GMU_130,2025-02-15 04:44:26,Is this in the USA?,-0.008218124508857727,United States,39.76,-98.5,,,,,,
GMU,GMU_159,2023-02-22 12:32:26,Pretty sure this girl I used to talk to worked in Crystal City and had to pay for parking.. not the first time I’ve heard of it either.,-0.10919331014156342,Crystal City,28.67748,-99.82811,,,,,,
GMU,GMU_164,2023-02-22 21:22:07,A lot of people go to GMU and there isn't exactly a lot of land to go around in the DC area.,-0.10538993775844574,District of Columbia,38.91706,-77.00025,,,,,,
GMU,GMU_168,2023-02-22 21:10:41,The other big joke is the gates they installed in Rapp deck.,-0.4946540892124176,Rapp,47.3961,7.84103,,,,,,
GMU,GMU_175,2023-02-22 11:27:36,"I'm going to get mass downvoted for this, but parking costs money to maintain and America has coddled drivers to make them think they are entitled to a parking spot for owning a car.",-0.7710381150245667,United States,39.76,-98.5,,,,,,
GMU,GMU_184,2023-02-22 12:14:20,"Based, bring this to osu",0.06565248221158981,Ōzu,33.5,132.55,,,,,,
GMU,GMU_229,2024-09-25 12:05:43,[gif](giphy|10bCgkbPzuKQog) There is definitely a dolphins-taking-over-Springfield vibe here.,0.5382881164550781,Springfield,42.10148,-72.58981,,,,,,
GMU,GMU_286,2022-12-07 16:25:44,The Southside one got me,0.11531459540128708,Southside,39.78121,-76.39468,,,,,,
GMU,GMU_296,2022-12-09 03:53:40,I can't help but feel like the Rappahannock parking deck one is targeted toward me...,-0.6310790777206421,Rappahannock County,38.68471,-78.15925,,,,,,
GMU,GMU_307,2022-12-07 01:40:13,I-66  are you from Cali?,-0.0015263461973518133,Chali,40.88208,44.10553,,,,,,
GMU,GMU_310,2023-03-29 22:26:44,"As an employee, the I-66 part got me.",0.009250323288142681,Super 8 Manassas / I- 66,38.7993,-77.5212,,,,,,
GMU,GMU_343,2025-10-01 17:55:40,"But gooning is Ohio so get on God.""",0.004971555434167385,Ohio,40.25034,-83.00018,,,,,,
GMU,GMU_355,2025-10-03 21:19:42,He’s the Iglesias Pentacostal Church Vans you see around Fairfax and Springfield,0.004028990399092436,Fairfax,40.33861,-95.39331,,,,,,
GMU,GMU_355,2025-10-03 21:19:42,He’s the Iglesias Pentacostal Church Vans you see around Fairfax and Springfield,0.004028990399092436,Springfield,42.10148,-72.58981,,,,,,
GMU,GMU_363,2025-10-02 03:16:22,tell me you're not from nova from without telling me,-0.15023936331272125,Nova,65.65053,12.65206,,,,,,
GMU,GMU_383,2025-10-03 11:03:01,"Pastor Jorge and Sister Cindy (""Ho No Mo"") -- a slut shamer, have free reign to minister on college campuses paid for with Virginia tax dollars... GMU is a state school, not a private one.",-0.13178156316280365,Virginia,37.54812,-77.44675,,,,,,
GMU,GMU_385,2025-10-03 11:03:01,"They are not employed by the school, or the state of Virginia and they are not students!",-0.8169208765029907,Virginia,37.54812,-77.44675,,,,,,
GMU,GMU_388,2020-04-03 22:25:47,Dolphins have returned to Mason Pond,0.010499384254217148,Mason Pond,41.64506,-72.80084,,,,,,
GMU,GMU_406,2020-04-04 00:33:40,Mason Pond is clearly manmade.,-0.5305525660514832,Mason Pond,41.64506,-72.80084,,,,,,
GMU,GMU_448,2023-10-19 21:54:17,"Run over to Giant for some raw calamari rings, and hand pieces to them.",0.00470708915963769,Giant,37.99048,-122.35719,,,,,,
GMU,GMU_497,2025-02-12 01:59:17,"The snow ball fights are so fun, I wasn’t in this particular one, but I was in a few snow ball fights close to Southside and The Ridge.",0.9362920522689819,Southside,39.78121,-76.39468,,,,,,
GMU,GMU_497,2025-02-12 01:59:17,"The snow ball fights are so fun, I wasn’t in this particular one, but I was in a few snow ball fights close to Southside and The Ridge.",0.9362920522689819,The Ridge,44.13342,-76.4327,,,,,,
GMU,GMU_500,2025-02-12 15:11:57,"We had a snowball fight in the commons outside Dickenson hall, too.",0.03991274535655975,Dickenson Hall,38.83167,-77.30472,,,,,,
GMU,GMU_509,2025-02-13 18:40:58,Is that Presidents Park?,-0.0027588121592998505,Presidents Park,38.89562,-77.03651,,,,,,
GMU,GMU_519,2023-11-16 23:16:24,They stopped at the stop sign near Lot A and I was crossing then all of a sudden they drive directly at me then stop right in front of me and there’s two girls just laughing at me then they drive off.,-0.08970385044813156,Altamaha River,31.31578,-81.28482,,,,,,
GMU,GMU_643,2025-02-15 10:40:51,The amount of social climbers at Mason is absurd.,-0.3038853108882904,Mason County,43.95625,-86.42258,,,,,,
GMU,GMU_700,2025-03-06 11:11:24,Graffiti at exploratory this morning,-0.14500831067562103,Miles Exploratory Learning Center,32.22101,-110.95023,,,,,,
GMU,GMU_726,2025-03-12 21:26:37,The Virginia flag goes so hard.,-0.33828336000442505,Virginia,37.54812,-77.44675,,,,,,
GMU,GMU_744,2025-03-07 16:33:43,Unless that is your building u r defacing then u should be arrested for vandalism I saw the same thing in cali 4 yrs ago PS If u vandalized i hope this post is used as evidence of a crime.,-0.8500933051109314,Derbent,42.06622,48.28759,,,,,,
GMU,GMU_764,2025-03-06 20:17:23,I think they meant president of the United States.,-0.06271176785230637,Territories of the United States,35.27766,-102.35403,,,,,,
GMU,GMU_794,2020-10-15 11:29:10,Only picture where GMU actually looks nice ...nice job!,0.9309141635894775,Gauriyamau,26.75703,81.79366,,,,,,
GMU,GMU_806,2020-10-15 11:17:19,"You can see the through the end of the first pic, that’s the whole new glass building constructed beside the Fenwick!",0.14294160902500153,Fenwick,41.27093,-72.35369,,,,,,
GMU,GMU_864,2025-09-06 16:31:10,what did washington do?,-0.01872223988175392,Washington,47.50012,-120.50147,,,,,,
GMU,GMU_875,2025-09-10 07:44:38,That's the governor that will turn Md into the next California,0.11331909149885178,Maryland,39.00039,-76.74997,,,,,,
GMU,GMU_875,2025-09-10 07:44:38,That's the governor that will turn Md into the next California,0.11331909149885178,California,37.25022,-119.75126,,,,,,
GMU,GMU_877,2025-09-07 21:19:14,Both are menaces to NY!,-0.429173082113266,New York City,40.71427,-74.00597,,,,,,
GMU,GMU_1096,2020-10-18 20:16:27,Lol I got called out for not citing the Gettysburg address,-0.3555031418800354,Gettysburg,39.83093,-77.2311,,,,,,
GMU,GMU_1138,2019-03-26 00:18:11,I thought he was teaching in London tho,-0.013190251775085926,London,51.50853,-0.12574,,,,,,
GMU,GMU_1143,2019-03-25 14:55:10,facts are facts america,-0.01287218276411295,United States,39.76,-98.5,,,,,,
GMU,GMU_1172,2019-03-25 18:02:37,Yeah a two week seminar in London for the summer and ne gorsuch for the same but in Padua Italy.,0.014285878278315067,London,51.50853,-0.12574,,,,,,
GMU,GMU_1172,2019-03-25 18:02:37,Yeah a two week seminar in London for the summer and ne gorsuch for the same but in Padua Italy.,0.014285878278315067,Padova,45.40797,11.88586,,,,,,
GMU,GMU_1172,2019-03-25 18:02:37,Yeah a two week seminar in London for the summer and ne gorsuch for the same but in Padua Italy.,0.014285878278315067,Italian Republic,42.83333,12.83333,,,,,,
GMU,GMU_1192,2019-03-25 21:15:21,They still probably think Russia & Venezuela are communist anyway.,-0.32516661286354065,Russian Federation,60.0,100.0,,,,,,
GMU,GMU_1192,2019-03-25 21:15:21,They still probably think Russia & Venezuela are communist anyway.,-0.32516661286354065,Bolivarian Republic of Venezuela,8.0,-66.0,,,,,,
GMU,GMU_1222,2025-03-09 19:00:25,"#HERstory made today in Henrico, VA!",0.10220407694578171,Henrico County,37.45771,-77.29646,,,,,,
GMU,GMU_1222,2025-03-09 19:00:25,"#HERstory made today in Henrico, VA!",0.10220407694578171,Virginia,37.54812,-77.44675,,,,,,
GMU,GMU_1231,2025-03-10 00:56:00,High point just did it today in the Big South tournament,0.22320537269115448,Big South Windmill,30.24797,-99.5995,,,,,,
GMU,GMU_1232,2021-01-06 17:26:20,A very kind soul slipped this under the door for me as I was sobbing in a bathroom stall in Exploratory my sophomore year of college.,0.2229878157377243,Vista PEAK Exploratory School,39.7192,-104.70111,,,,,,
GMU,GMU_1274,2022-12-02 16:45:59,Wait so non-Mason students can get away with getting parking tickets at Mason?,-0.2972244918346405,Mason County,30.71772,-99.22613,,,,,,
GMU,GMU_1275,2022-12-02 17:51:34,"Same thing if you get a **parking, red light, or speed camera ticket** in DC or MD.",-0.2789250612258911,District of Columbia,38.91706,-77.00025,,,,,,
GMU,GMU_1275,2022-12-02 17:51:34,"Same thing if you get a **parking, red light, or speed camera ticket** in DC or MD.",-0.2789250612258911,Maryland,39.00039,-76.74997,,,,,,
GMU,GMU_1282,2022-12-02 17:53:48,I need more context i worked in DC for few months and got three speeding ticket in the same place and time each time.,-0.6155012249946594,District of Columbia,38.91706,-77.00025,,,,,,
GMU,GMU_1284,2022-12-03 00:33:24,I've gotten 3 speed camera tickets in Maryland and paid them all off; the car isn't registered to me either,-0.5217335820198059,Maryland,39.00039,-76.74997,,,,,,
GMU,GMU_1292,2025-08-26 07:40:28,"I've always found Washington pretty milquetoast, I'm extremely glad to see this.",0.9689807891845703,Washington,47.50012,-120.50147,,,,,,
GMU,GMU_1320,2020-09-19 21:15:48,"Having taken a class in Krug, I'd be surprised if it's not one of the original buildings.",0.0016310106730088592,Krug,43.71917,17.10278,,,,,,
GMU,GMU_1327,2020-09-20 09:52:53,"I feel like there has been construction there for decades now, similar to UMCP.",-0.06940802931785583,University of Maryland - College Park,38.98861,-76.9397,,,,,,
GMU,GMU_1328,2020-09-20 09:52:53,The growth in DC metropolitan area is just huge.,0.8363473415374756,District of Columbia,38.91706,-77.00025,,,,,,
GMU,GMU_1336,2020-09-19 21:39:33,"West, East, Krug, and Finley are the original 4 Fairfax Campus buildings (Krug and Finley may have originally been named ""South"" and ""North"").",0.00054984848247841,West Village,42.56676,-71.112,,,,,,
GMU,GMU_1336,2020-09-19 21:39:33,"West, East, Krug, and Finley are the original 4 Fairfax Campus buildings (Krug and Finley may have originally been named ""South"" and ""North"").",0.00054984848247841,Austurland,65.0,-15.0,,,,,,
GMU,GMU_1336,2020-09-19 21:39:33,"West, East, Krug, and Finley are the original 4 Fairfax Campus buildings (Krug and Finley may have originally been named ""South"" and ""North"").",0.00054984848247841,Krug,38.51796,-122.48165,,,,,,
GMU,GMU_1336,2020-09-19 21:39:33,"West, East, Krug, and Finley are the original 4 Fairfax Campus buildings (Krug and Finley may have originally been named ""South"" and ""North"").",0.00054984848247841,Finley,33.74621,-96.18609,,,,,,
GMU,GMU_1336,2020-09-19 21:39:33,"West, East, Krug, and Finley are the original 4 Fairfax Campus buildings (Krug and Finley may have originally been named ""South"" and ""North"").",0.00054984848247841,Fairfax Learning Center,39.14029,-94.63265,,,,,,
GMU,GMU_1336,2020-09-19 21:39:33,"West, East, Krug, and Finley are the original 4 Fairfax Campus buildings (Krug and Finley may have originally been named ""South"" and ""North"").",0.00054984848247841,Krug,38.51796,-122.48165,,,,,,
GMU,GMU_1336,2020-09-19 21:39:33,"West, East, Krug, and Finley are the original 4 Fairfax Campus buildings (Krug and Finley may have originally been named ""South"" and ""North"").",0.00054984848247841,Finley,33.74621,-96.18609,,,,,,
GMU,GMU_1336,2020-09-19 21:39:33,"West, East, Krug, and Finley are the original 4 Fairfax Campus buildings (Krug and Finley may have originally been named ""South"" and ""North"").",0.00054984848247841,Suðurland,64.0,-19.0,,,,,,
GMU,GMU_1337,2020-09-19 21:39:33,"Classes were first held in an [old school near Bailey's Crossroads](http://ahistoryofmason.gmu.edu/exhibits/show/schoolhouse/contents/schoolhouse), but this was temporary while Fairfax campus was planned and built.",-0.0026129651814699173,Fairfax,38.84622,-77.30637,,,,,,
GMU,GMU_1338,2020-09-20 13:29:11,I believe that's the Inova Emergency room and Sunrise at George Mason (Senior Living facility).,0.007340575568377972,Inova,-19.51667,28.6,,,,,,
GMU,GMU_1338,2020-09-20 13:29:11,I believe that's the Inova Emergency room and Sunrise at George Mason (Senior Living facility).,0.007340575568377972,Sunrise,36.07314,-83.79129,,,,,,
GMU,GMU_1382,2020-09-30 19:23:02,"nature is healing, the bears are coming back to gmu",0.572156548500061,Greenville Downtown Airport,34.85031,-82.3509,,,,,,
GMU,GMU_1407,2020-10-01 00:01:06,Between 1900 and 2009 there have only been 63 people killed by black bears in the US and Canada.,-0.5668126344680786,United States,39.76,-98.5,,,,,,
GMU,GMU_1407,2020-10-01 00:01:06,Between 1900 and 2009 there have only been 63 people killed by black bears in the US and Canada.,-0.5668126344680786,Canada,60.10867,-113.64258,,,,,,
GMU,GMU_1408,2020-10-01 00:01:06,https://www.smithsonianmag.com/science-nature/how-to-avoid-being-eaten-by-a-black-bear-179225111/ None of which were in Virginia.,-0.09526395797729492,Virginia,37.54812,-77.44675,,,,,,
GMU,GMU_1435,2020-09-11 17:43:34,Most nights I’d go to Mason Pond until I felt like leaving.,0.0027541392482817173,Mason Pond,41.64506,-72.80084,,,,,,
GMU,GMU_1475,2020-07-21 17:45:15,"We were pretty chill, and luckily had a house (might still) literally 2 blocks north of campus on University Dr.",0.7888985276222229,Hampton Inn & Suites Salt Lake City University-Foothill Dr.,40.74048,-111.82554,,,,,,
GMU,GMU_1509,2020-07-21 15:54:12,"Now, the U.S. was fundamentally founded on capitalism so if that something that you don’t agree with that’s your choice, but in this case it is fair to say why not go elsewhere then?",-0.15001757442951202,United States,39.76,-98.5,,,,,,
GMU,GMU_1519,2020-07-21 18:23:50,"There’s a reason why Amazon, Microsoft, Netflix, Apple, Google, Twitter, hell even the very platform we’re having this discussion on right now, and pretty much any other major revolutionary company, all originated in the U.S. There’s a reason why our top universities are more prestigious than those of other Western countries even though their top institutions have been around a lot longer.",0.7213988304138184,United States,39.76,-98.5,,,,,,
GMU,GMU_1522,2020-07-21 18:23:50,"And finally, there is a reason why people from all over the world want to immigrate to “America”.",-0.2591521143913269,United States,39.76,-98.5,,,,,,
GMU,GMU_1523,2020-07-21 18:23:50,"I’m neither white, even remotely wealthy, nor a natural-born American; I immigrated here with my family, leaving our relatively well-off life and coming here where we were essentially poor for the first decade plus, so to be clear this is not some patriotism-blinded view of the U.S.",-0.17797113955020905,United States,39.76,-98.5,,,,,,
GMU,GMU_1524,2020-07-21 18:23:50,"So that said, we have our fair share of problems like any other country, and constructively critiquing specifics of where you think capitalism or any aspects of the U.S. fall short, in order to improve it (as every engaged citizen should do), is one thing, but completely trashing it as a concept altogether (what you basically did about capitalism, and what many do regarding the U.S. as a whole) is another.",-0.4963967204093933,United States,39.76,-98.5,,,,,,
GMU,GMU_1524,2020-07-21 18:23:50,"So that said, we have our fair share of problems like any other country, and constructively critiquing specifics of where you think capitalism or any aspects of the U.S. fall short, in order to improve it (as every engaged citizen should do), is one thing, but completely trashing it as a concept altogether (what you basically did about capitalism, and what many do regarding the U.S. as a whole) is another.",-0.4963967204093933,United States,39.76,-98.5,,,,,,
GMU,GMU_1563,2022-12-13 03:45:39,"In addition, if you’re coming here to the Fairfax campus, Fairfax City not half a mile north is an excellent place for food and errands.",0.9198632836341858,Fairfax,38.84622,-77.30637,,,,,,
GMU,GMU_1563,2022-12-13 03:45:39,"In addition, if you’re coming here to the Fairfax campus, Fairfax City not half a mile north is an excellent place for food and errands.",0.9198632836341858,Fairfax,38.84622,-77.30637,,,,,,
GMU,GMU_1584,2022-12-13 01:20:14,North Carolina,0.0011078210081905127,North Carolina,35.50069,-80.00032,,,,,,
GMU,GMU_1585,2024-10-03 22:53:30,Average JC hallway flier,-0.054936733096838,Jc Contemporary,41.79959,12.47982,,,,,,
GMU,GMU_1608,2020-08-26 13:07:15,I'm on the Arlington campus.,0.000778740388341248,Arlington,32.73569,-97.10807,,,,,,
GMU,GMU_1615,2020-08-26 22:26:44,I know its normal in Spain.,0.010174493305385113,Kingdom of Spain,40.0,-4.0,,,,,,
GMU,GMU_1616,2020-08-26 15:13:22,"Can't think of any place on Mason like this - but if this isn't Mason, we need it here!",-0.1141587495803833,Mason County,43.95625,-86.42258,,,,,,
GMU,GMU_1689,2023-09-03 14:06:32,"The protesters at Southside or the Johnson Center, they just show up and bother everyone.",-0.7696394920349121,Southside,17.96569,-76.78624,,,,,,
GMU,GMU_1689,2023-09-03 14:06:32,"The protesters at Southside or the Johnson Center, they just show up and bother everyone.",-0.7696394920349121,Johnson Center for The Arts,39.47806,-86.0475,,,,,,
GMU,GMU_1747,2025-01-20 20:11:33,"This was at The Grove, but I also went around campus this morning and found fox prints in a lot of grassy/wooded areas",0.0434659942984581,The Grove,51.67708,-0.43825,,,,,,
GMU,GMU_1766,2020-03-17 00:25:02,"Shit I'll send them an email too and I don't even go to Mason anymore, I just want to bother the devil-on-earth that is Mason parking",-0.9227188229560852,Mason County,43.95625,-86.42258,,,,,,
GMU,GMU_1766,2020-03-17 00:25:02,"Shit I'll send them an email too and I don't even go to Mason anymore, I just want to bother the devil-on-earth that is Mason parking",-0.9227188229560852,Mason County,43.95625,-86.42258,,,,,,
GMU,GMU_1853,2025-10-16 13:03:40,"""Shibboleth"" is actually the name of the open-source single sign-on infrastructure they have been using for a long time.",0.0061825476586818695,Shibboleth,38.00561,-90.70541,,,,,,
GMU,GMU_1880,2022-04-26 16:44:37,GMU where the G stands for Gnowledge,-0.0031619917135685682,Greenville Downtown Airport,34.85031,-82.3509,,,,,,
GMU,GMU_1882,2022-04-26 19:32:28,They were given a notice and if they return they'll be arrested :) So yes just call mason police,-0.10692492127418518,Mason County,43.95625,-86.42258,,,,,,
GMU,GMU_1883,2022-04-26 16:26:34,They’ve gone to Eastern Shore and Hampton Roads,0.002651038346812129,Eastern Shore,38.50012,-75.49964,,,,,,
GMU,GMU_1883,2022-04-26 16:26:34,They’ve gone to Eastern Shore and Hampton Roads,0.002651038346812129,Hampton Roads,36.97515,-76.34967,,,,,,
GMU,GMU_1888,2022-04-26 19:31:41,"Yes get police involved, we called police on them in Eastern Shore and they were told if they return they'll be arrested.",-0.4454416334629059,Eastern Shore,38.50012,-75.49964,,,,,,
GMU,GMU_1916,2025-03-06 22:58:53,Feel free to move to the middle east,0.029274702072143555,Al Bank al Brīţānī lish Sharq al Awsaţ,25.2643,55.29326,,,,,,
GMU,GMU_1933,2025-03-07 01:17:41,"No thanks, don't want to get bombed by the US",-0.626058042049408,United States,39.76,-98.5,,,,,,
GMU,GMU_1935,2025-03-06 23:14:46,"Just above this post I had this … https://www.reddit.com/r/washingtondc/s/cmcG5VNgB0 and another post about Warren County, VA closing the Front Royal Public Library because they have LGBTQ books.",-0.11702235043048859,Warren County,38.90878,-78.20746,,,,,,
GMU,GMU_1935,2025-03-06 23:14:46,"Just above this post I had this … https://www.reddit.com/r/washingtondc/s/cmcG5VNgB0 and another post about Warren County, VA closing the Front Royal Public Library because they have LGBTQ books.",-0.11702235043048859,Virginia,37.54812,-77.44675,,,,,,
GMU,GMU_1936,2025-03-06 23:14:46,That’s a bit closer than the Middle East.,-0.010225564241409302,Al Bank al Brīţānī lish Sharq al Awsaţ,25.2643,55.29326,,,,,,
GMU,GMU_2052,2019-05-12 00:43:10,I thought George Masons campus was just a Starbucks parking lot in Nova,-0.1430952399969101,Nova,64.48632,11.0805,,,,,,
GMU,GMU_2056,2019-05-09 07:03:12,"Before that was Exploratory, before that was all the other newish dorms and Merten Hall",-8.138187695294619e-05,Vista PEAK Exploratory School,39.7192,-104.70111,,,,,,
GMU,GMU_2063,2022-03-25 16:00:18,This is for the dudes racing their loud cars in the middle of the night on Braddock,-0.07948217540979385,Braddock Hills,40.41729,-79.86505,,,,,,
GMU,GMU_2077,2022-04-23 01:42:37,this happens constantly at the shenandoah parking deck,-0.04340275377035141,Shenandoah,40.82037,-76.20077,,,,,,
GMU,GMU_2111,2018-11-09 19:07:08,"It wasn’t our fault but now we have to do extra work, because if eagle bank arena….",-0.23860937356948853,Eagle Bank,-30.25118,139.91602,,,,,,
GMU,GMU_2120,2018-11-09 20:12:07,if eagle bank arena what????,-0.05049818381667137,Eagle Bank,-30.25118,139.91602,,,,,,
GMU,GMU_2133,2020-06-20 21:58:13,I thought you said West!,-0.025513451546430588,West,42.77268,-116.9579,,,,,,
GMU,GMU_2151,2025-10-04 17:46:23,I've never seen a bird like that in VA,-0.24337752163410187,Virginia,37.54812,-77.44675,,,,,,
GMU,GMU_2162,2025-10-06 15:16:20,It was by the long wooden bridge in the wooded area past the mason pond parking deck,0.003082330571487546,Mason Pond,41.64506,-72.80084,,,,,,
GMU,GMU_2182,2025-10-04 22:21:20,"Some species experience strong natural selection for rapidly increased fertility when population drops significantly, that's why big cities like New York City can never get rid of all their rats or other rodents.",-0.32082074880599976,New York City,40.71427,-74.00597,,,,,,
GMU,GMU_2192,2025-10-04 19:05:51,They're EVERYWHERE if you check my profile I posted a picture of a tree outside of Southside I found on my way back to my hall yesterday,0.09143128246068954,Southside,39.78121,-76.39468,,,,,,
GMU,GMU_2193,2025-10-04 17:51:04,"they were introduced to the US in the mid 2010s, only have been in VA for a couple years",0.01152658462524414,United States,39.76,-98.5,,,,,,
GMU,GMU_2193,2025-10-04 17:51:04,"they were introduced to the US in the mid 2010s, only have been in VA for a couple years",0.01152658462524414,Virginia,37.54812,-77.44675,,,,,,
GMU,GMU_2204,2025-10-04 15:57:27,"You actually should, as they're invasive - they've multiplied in such large numbers due to having no natural predators here in the US, and have been consuming resources normally used by other insects So by not killing you're allowing non invasive species to die, which will then limit food for birds, killing birds, etc.- you kill a lot more creatures by not killing lanternflies than by killing them",-0.5892893671989441,United States,39.76,-98.5,,,,,,
GMU,GMU_2249,2020-07-29 19:11:44,Use the “search by Officer name” option and input his name: “John Spivey” - When you search the New Orleans address (5414 Constance street) listed on the website above its actually a run down looking house.,-0.10535359382629395,New Orleans,29.95465,-90.07507,,,,,,
