school_name,unique_id,date,sentences,roberta_compound,place,latitude,longitude,revised_place,revised_latitude,revised_longitude,place_type,false_positive,checked_by
GMU,GMU_5167,2023-10-11 23:43:18,"Can’t even say the MIT of Fairfax County cause if you ever move to Silicon Valley once you graduate and you tell people you’re from Fairfax, VA they’ll just assume you went to Thomas Jefferson .",-0.19054707884788513,Santa Clara Valley,37.24883,-121.83995,,,,,,
GMU,GMU_5167,2023-10-11 23:43:18,"Can’t even say the MIT of Fairfax County cause if you ever move to Silicon Valley once you graduate and you tell people you’re from Fairfax, VA they’ll just assume you went to Thomas Jefferson .",-0.19054707884788513,Fairfax,38.84622,-77.30637,,,,,,
GMU,GMU_5167,2023-10-11 23:43:18,"Can’t even say the MIT of Fairfax County cause if you ever move to Silicon Valley once you graduate and you tell people you’re from Fairfax, VA they’ll just assume you went to Thomas Jefferson .",-0.19054707884788513,Virginia,37.54812,-77.44675,,,,,,
GMU,GMU_5289,2024-08-30 09:59:16,I wouldn’t expect them to have morals at the Raytheon pipeline,-0.3125997483730316,Raytheon Heliport,42.43065,-71.252,,,,,,
GMU,GMU_5333,2021-02-03 09:34:08,It's between President's Park and the Hub.,0.0028341561555862427,President's Park,39.01111,-84.57306,,,,,,
GMU,GMU_5333,2021-02-03 09:34:08,It's between President's Park and the Hub.,0.0028341561555862427,Hub,36.40217,-119.80903,,,,,,
GMU,GMU_5373,2020-11-30 08:13:41,GMU is one of the cheapest and best value colleges in Virginia and the USA can’t really complain,0.5618529915809631,Virginia,37.54812,-77.44675,,,,,,
GMU,GMU_5373,2020-11-30 08:13:41,GMU is one of the cheapest and best value colleges in Virginia and the USA can’t really complain,0.5618529915809631,United States,39.76,-98.5,,,,,,
GMU,GMU_5380,2020-11-30 19:21:06,"I think about transfering out too, but I don't really know any other schools in Virginia.",-0.04218515008687973,Virginia,37.54812,-77.44675,,,,,,
GMU,GMU_5438,2020-05-29 09:22:36,I graduated in 2018 and I’ll still talk about Robinson and probably refer to the new building as Robinson,0.023382235318422318,Robinson,39.00532,-87.73919,,,,,,
GMU,GMU_5438,2020-05-29 09:22:36,I graduated in 2018 and I’ll still talk about Robinson and probably refer to the new building as Robinson,0.023382235318422318,Robinson,39.00532,-87.73919,,,,,,
GMU,GMU_5521,2020-07-02 19:32:04,"Why is it that you hate how the American government has handled this pandemic, yet you blindly trust them that masks work, when it runs contrary to the common consensus in Europe?",-0.8172153830528259,Europe,48.69096,9.14062,,,,,,
GMU,GMU_5562,2024-04-27 01:31:36,I know you can drown in a bathtub but you'd have to really screw up to drown in the Mason pond.,-0.7220652103424072,Mason County,43.95625,-86.42258,,,,,,
GMU,GMU_5566,2024-04-26 20:31:24,Hell I had to take a behavior class because I took my mask down to sip water in the kitchen room of Taylor hall.,-0.6276288032531738,Taylor Hall,41.68639,-73.89778,,,,,,
GMU,GMU_5670,2020-08-29 18:10:34,"Somebody please remind me why the heck GMU being the largest university in Virginia contracted with a new and shady company that popped out of nowhere for an emergency that involves the life of students, faculty and a good chunk of Fairfax county",-0.8412913084030151,Virginia,37.54812,-77.44675,,,,,,
GMU,GMU_5670,2020-08-29 18:10:34,"Somebody please remind me why the heck GMU being the largest university in Virginia contracted with a new and shady company that popped out of nowhere for an emergency that involves the life of students, faculty and a good chunk of Fairfax county",-0.8412913084030151,Fairfax County,38.83469,-77.27622,,,,,,
GMU,GMU_5685,2020-08-29 19:57:33,Now I wonder why three of the biggest and most important universities of Virginia did that decision.,-5.225906352279708e-05,Virginia,37.54812,-77.44675,,,,,,
GMU,GMU_5692,2020-08-31 18:56:03,"The registration information for Kallaco resolves to a residential neighborhood in New Orleans, it is also designated as the Principle Business Office.",0.0001968496508197859,New Orleans,29.95465,-90.07507,,,,,,
GMU,GMU_5694,2020-08-31 18:56:03,"The Registration Domicile Address resolves to 1209 Orange Street, Wilmington, Delaware.",-0.0004334303957875818,Wilmington,39.74595,-75.54659,,,,,,
GMU,GMU_5694,2020-08-31 18:56:03,"The Registration Domicile Address resolves to 1209 Orange Street, Wilmington, Delaware.",-0.0004334303957875818,Delaware,39.00039,-75.49992,,,,,,
GMU,GMU_5695,2020-08-31 18:56:03,"This is the the same address as the Corporation Trust Company and that address has thousands of companies registered to the same address, due to Delaware's laws regarding incorporation and state taxes.",-0.056098971515893936,Delaware,39.00039,-75.49992,,,,,,
GMU,GMU_5708,2020-08-31 19:25:03,Some states (ahem LA and DE) also make it difficult by not showing members of a company.,-0.6390085816383362,Los Angeles,34.05223,-118.24368,,,,,,
GMU,GMU_5708,2020-08-31 19:25:03,Some states (ahem LA and DE) also make it difficult by not showing members of a company.,-0.6390085816383362,Delaware,39.00039,-75.49992,,,,,,
GMU,GMU_5709,2020-08-31 19:25:03,"One case is my company: I’m the registered agent and the registered office is my house, but the business office is another member’s house, meanwhile (bc it’s Texas) all members are listed publicly.",-0.006857515778392553,Texas,31.25044,-99.25061,,,,,,
GMU,GMU_5712,2020-08-31 19:25:03,Kallaco is also violating Virginia law.,-0.7327455878257751,Virginia,37.54812,-77.44675,,,,,,
GMU,GMU_5713,2020-08-31 19:25:03,"Their HIPPA privacy office is in Glen Allen, which is considered transacting business in the state, and the law requires registration with the VA SCC before transacting business - but they’re not registered.",-0.21729512512683868,Glen Allen,37.66598,-77.50637,,,,,,
GMU,GMU_5805,2020-03-19 20:00:18,I have to stay on campus for the remainder of the semester so I’m practically in Potomac by myself.,-0.010781933553516865,Potomac,40.15285,-80.52924,,,,,,
GMU,GMU_5869,2024-11-15 13:55:52,bring back the fountain in the jc!,0.31229162216186523,JC Tank,33.81574,-109.14594,,,,,,
GMU,GMU_5881,2024-11-22 10:56:23,that could've been a cool tradition at mason,0.8273842930793762,Mason County,43.95625,-86.42258,,,,,,
GMU,GMU_5890,2024-11-15 22:26:51,I remember the fountain back when the Johnson Center was new.,0.02306623011827469,Johnson Center for The Arts,39.47806,-86.0475,,,,,,
GMU,GMU_5908,2024-11-17 15:06:13,"The Johnson Center was dedicated in 96, which tracks with my recollection.",0.0019942419603466988,Johnson Center for The Arts,39.47806,-86.0475,,,,,,
GMU,GMU_5924,2024-11-13 17:05:59,Worse than East Building and David King Hall?,-0.7032203674316406,East Building,38.83278,-77.30861,,,,,,
GMU,GMU_5924,2024-11-13 17:05:59,Worse than East Building and David King Hall?,-0.7032203674316406,David King Hall,38.83056,-77.30694,,,,,,
GMU,GMU_6076,2025-03-19 23:05:05,"see you at skyline man, keep your chin up 🫡",0.6561256647109985,Skyline,45.36327,-75.72732,,,,,,
GMU,GMU_6171,2025-10-03 17:59:25,Tyler Cowan is a respected member of the GMU faculty and is a responsible contributing member of the Fairfax community.,0.8428953886032104,Fairfax,38.84622,-77.30637,,,,,,
GMU,GMU_6188,2025-10-03 18:11:00,Your reply reads like a cookie cutter defense from the Vatican.,-0.3463898003101349,State of the Vatican City,41.90225,12.4533,,,,,,
GMU,GMU_6324,2022-09-18 20:00:26,Found this little guy swimming into mason pond,0.021086448803544044,Mason Pond,41.64506,-72.80084,,,,,,
GMU,GMU_6329,2022-09-18 20:37:42,Such a rare site to see in mason,0.1738952249288559,Mason,46.05008,-80.48299,,,,,,
GMU,GMU_6334,2022-09-19 02:00:51,A few years back I once saw a turtle or a tortoise swimming around by the bridge in the Mason pond area.,0.013508033938705921,Masonville,45.91274,-86.98736,,,,,,
GMU,GMU_6368,2020-12-01 14:51:34,For off campus students I’m sure even if you’re all the way in Delaware they want you to do it.,0.024639202281832695,Delaware,39.00039,-75.49992,,,,,,
GMU,GMU_6383,2024-12-04 01:33:19,"IN THE EARLY morning hours of November 7, more than 12 police officers showed up outside at an address in Springfield, Virginia, knocked, broke down the door, and raided the family home of two Palestinian American students at George Mason University.",-0.32821330428123474,Springfield,38.78928,-77.1872,,,,,,
GMU,GMU_6383,2024-12-04 01:33:19,"IN THE EARLY morning hours of November 7, more than 12 police officers showed up outside at an address in Springfield, Virginia, knocked, broke down the door, and raided the family home of two Palestinian American students at George Mason University.",-0.32821330428123474,Virginia,37.54812,-77.44675,,,,,,
GMU,GMU_6384,2024-12-04 01:33:19,University and Fairfax County police refused to show the family the warrant.,-0.435619980096817,Fairfax County,38.83469,-77.27622,,,,,,
GMU,GMU_6385,2024-12-04 01:33:19,One Fairfax County detective with the FBI’s Joint Terrorism Task Force — cross-designated as a local and federal agent — was also present.,0.00024980652960948646,Fairfax County,38.83469,-77.27622,,,,,,
GMU,GMU_6436,2024-12-04 08:58:42,Please converse with other students with respect and keep in mind that Mason is an academic environment.,0.16133759915828705,Mason County,43.95625,-86.42258,,,,,,
GMU,GMU_6444,2024-12-04 08:56:54,Please converse with other students with respect and keep in mind that Mason is an academic environment.,0.16133759915828705,Mason County,43.95625,-86.42258,,,,,,
GMU,GMU_6457,2025-02-03 20:15:06,Once went to southside and got a turkey melt… they forgot to take the plastic off the cheese…,-0.48103615641593933,Southside,39.78121,-76.39468,,,,,,
GMU,GMU_6462,2025-02-03 20:40:45,I went to Southside once... and they forgot to add the sauce to the pizza...,-0.6442428827285767,Southside,39.78121,-76.39468,,,,,,
GMU,GMU_6473,2025-02-04 11:15:11,I go to Southside occasionally when I’m feeling picky and just want random stuff on my plate (or a whole lot of cereal) but I don’t find it worth it for the meal plans.,-0.5943271517753601,Southside,39.78121,-76.39468,,,,,,
GMU,GMU_6485,2025-02-05 12:44:53,southside has given me food poisoning a couple times too!,-0.8569463491439819,Southside,39.78121,-76.39468,,,,,,
GMU,GMU_6488,2025-02-05 22:30:00,"I will tell you, they're still not like... Great all the time, but ikes on its worst days is as good or better than Southside on its best days.",-0.01657416671514511,Southside,39.78121,-76.39468,,,,,,
GMU,GMU_6491,2025-02-05 22:30:00,Southside being central is so much more convenient.,0.7377574443817139,Southside,39.78121,-76.39468,,,,,,
GMU,GMU_6493,2025-02-05 22:57:46,Average southside meal tbh globe neg diffs (though you have to go on an expedition to get there),-0.0017671476816758513,Southside,39.78121,-76.39468,,,,,,
GMU,GMU_6564,2024-05-02 18:20:42,It's northern Virginia.,0.0004557351639959961,Virginia,37.54812,-77.44675,,,,,,
GMU,GMU_6584,2020-02-09 08:58:05,I lived in NoVA from 1993 until last year.,-0.002399555640295148,Nova,64.48632,11.0805,,,,,,
GMU,GMU_6625,2025-03-21 18:26:06,Southside ahh 🥀🥀,0.3335720896720886,Southside,39.78121,-76.39468,,,,,,
GMU,GMU_6626,2025-03-21 19:14:11,Southside so nasty!,-0.8921942114830017,Southside,39.78121,-76.39468,,,,,,
GMU,GMU_6632,2025-02-02 19:33:45,I was watching this YouTube Short and realized the Johnson Center was the background,0.02005688101053238,Johnson Center for The Arts,39.47806,-86.0475,,,,,,
GMU,GMU_6635,2025-02-02 19:44:42,"What was the video about, Norway?",-0.0032805067021399736,Kingdom of Norway,62.0,10.0,,,,,,
GMU,GMU_6638,2019-01-23 17:22:23,Mason student attempts to get to class amongst campus construction (2019 colorized),-0.006352825555950403,Mason County,43.95625,-86.42258,,,,,,
GMU,GMU_6645,2018-11-10 10:22:16,"So, on Wednesday on my way to Fairfax for my 7:10 class, I checked google maps to see how bad traffic is and if I need to use a different road to get into campus.",-0.36071905493736267,Fairfax,38.84622,-77.30637,,,,,,
GMU,GMU_6647,2018-11-10 10:22:16,"The campus being at a standstill was a given, but all the roads outside of mason were also backed up, some of them for about a mile (worst I had seen).",-0.5716950297355652,Mason County,43.95625,-86.42258,,,,,,
GMU,GMU_6709,2018-11-10 10:22:16,&#x200B; >A power line was cut accidentally due to construction calm down >i dont even have class on Fairfax but i agree with you bud.,-0.27415359020233154,Fairfax,38.84622,-77.30637,,,,,,
GMU,GMU_6721,2018-11-10 10:22:16,"It wasn’t our fault but now we have to do extra work, because if eagle bank arena….",-0.23860937356948853,Eagle Bank,-30.25118,139.91602,,,,,,
GMU,GMU_6750,2018-11-10 10:22:16,>if eagle bank arena what?,-0.028976039960980415,Eagle Bank,-30.25118,139.91602,,,,,,
GMU,GMU_6764,2018-11-10 10:22:16,"It wasn’t our fault but now we have to do extra work, because if eagle bank arena….",-0.23860937356948853,Eagle Bank,-30.25118,139.91602,,,,,,
GMU,GMU_6780,2018-11-10 14:01:48,you know mason is a boring campus when people have fun through emails,-0.14639246463775635,Mason,42.5792,-84.44358,,,,,,
GMU,GMU_6843,2025-05-16 01:13:26,At least some other countries get cool things like swords when you get a PhD in Sweden.,0.33534160256385803,Kingdom of Sweden,62.0,15.0,,,,,,
GMU,GMU_6844,2025-01-28 15:12:13,"I saw some people standing in the frozen over Mason pond (Please do not do this, you could fall into freezing water)",-0.6297610402107239,Masonville,45.91274,-86.98736,,,,,,
GMU,GMU_6851,2025-01-28 15:23:34,There's been more than a dozen hospitalizations in Fairfax County within the last month for similar results from standing on lakes that appear to be frozen over.,-0.029735511168837547,Fairfax County,38.83469,-77.27622,,,,,,
GMU,GMU_6852,2025-01-28 15:23:34,"While the Mason pond is rather shallow, it can still be fairly dangerous.",-0.48548808693885803,Måsön,58.86667,16.75,,,,,,
GMU,GMU_6902,2023-11-15 00:32:01,"And as someone who works at a business in the Johnson Center, maybe it was a *little* disruptive, but when there is a genocide happening, people have the right to be disruptive?",-0.41420528292655945,Johnson Center for The Arts,39.47806,-86.0475,,,,,,
GMU,GMU_6919,2023-11-15 20:54:40,He makes more than the President of the United States!,-0.019913138821721077,Territories of the United States,35.27766,-102.35403,,,,,,
GMU,GMU_6951,2023-10-07 15:45:47,I graduated with a BA in Human Development and Family Science in spring of 2023 and now I work an Child Protective Investigator for the state of Florida making 50k a year starting,0.056698694825172424,Florida,28.75054,-82.5001,,,,,,
GMU,GMU_7030,2021-02-10 20:45:21,As someone who just transferred home from a school in ohio i can say unequivocally that northern va is not cold.,0.27656275033950806,Ohio,40.25034,-83.00018,,,,,,
GMU,GMU_7039,2021-02-10 20:58:33,"I have never stayed in Ohio long enough (only drove through and it was cold af), but I don't know if it gets as humid there.",-0.4571992754936218,Ohio,40.25034,-83.00018,,,,,,
GMU,GMU_7040,2021-02-10 22:07:55,"It's not that cold, but I've noticed when I've driven from Richmond up to DC that it's consistently colder in DC than it is in Richmond.",-0.21661242842674255,Richmond,37.55376,-77.46026,,,,,,
GMU,GMU_7040,2021-02-10 22:07:55,"It's not that cold, but I've noticed when I've driven from Richmond up to DC that it's consistently colder in DC than it is in Richmond.",-0.21661242842674255,District of Columbia,38.91706,-77.00025,,,,,,
GMU,GMU_7040,2021-02-10 22:07:55,"It's not that cold, but I've noticed when I've driven from Richmond up to DC that it's consistently colder in DC than it is in Richmond.",-0.21661242842674255,District of Columbia,38.91706,-77.00025,,,,,,
GMU,GMU_7040,2021-02-10 22:07:55,"It's not that cold, but I've noticed when I've driven from Richmond up to DC that it's consistently colder in DC than it is in Richmond.",-0.21661242842674255,Richmond,37.55376,-77.46026,,,,,,
GMU,GMU_7061,2024-12-10 23:06:43,Some cool/creepy pics from tonight 12/10/24 Campus looked really awesome tonight with all the fog and barely anyone around,0.9779030084609985,Campus,36.82629,10.14445,,,,,,
GMU,GMU_7075,2024-12-11 08:16:01,This is the version of mason I remember  those cold nights walking back to ur car in lot A after an evening/night class,-0.014767665416002274,Ham-A-Lot Field,41.84256,-83.68596,,,,,,
GMU,GMU_7080,2024-12-11 09:31:29,Silent Hill.,-0.01870894432067871,Silent Hill,-18.20814,144.67878,,,,,,
GMU,GMU_7094,2024-12-11 01:32:00,Pictures taken on my way back to K lot from Fenwick,0.0007182832923717797,Fenwick,55.65,-1.88333,,,,,,
GMU,GMU_7187,2024-11-23 15:30:13,Man I’m so glad I took 207 back when we were still using PHP so I wouldn’t have to go through all this bs,0.056650735437870026,Interchange 207,41.68949,-83.53466,,,,,,
GMU,GMU_7287,2022-01-30 02:21:45,I see it all the time in the jc building,0.023440202698111534,Jc Contemporary,41.79959,12.47982,,,,,,
GMU,GMU_7400,2019-09-11 19:31:13,I think educators as a whole are fucked simply because in the USA they are underpaid.,-0.9394180178642273,United States,39.76,-98.5,,,,,,
GMU,GMU_7403,2019-09-11 19:31:13,"Fairfax county pays their teachers well too, at about $60k/yr... but you need a masters degree.",0.12790647149085999,Fairfax County,38.83469,-77.27622,,,,,,
GMU,GMU_7417,2019-05-30 22:56:13,"I definitely agree that we need an unsubscribe option, because I will never have to, or have any desire to, go to any campuses besides the Fairfax one.",-0.3014809489250183,Fairfax,38.84622,-77.30637,,,,,,
GMU,GMU_7418,2019-05-31 04:58:48,"RAVE Guardian: Hey, the power's out in Arlington.",-0.2967115640640259,Arlington,32.73569,-97.10807,,,,,,
GMU,GMU_7419,2019-05-31 04:58:48,"Personal Email: Hey, the power's out in Arlington.",-0.49578866362571716,Arlington,32.73569,-97.10807,,,,,,
GMU,GMU_7420,2019-05-31 04:58:48,"Mason Email: Hey, the power's out in Arlington.",-0.3773302137851715,Arlington,32.73569,-97.10807,,,,,,
GMU,GMU_7421,2019-05-31 04:58:48,"SMS: Hey, the power's out in Arlington.",-0.43789923191070557,Arlington,32.73569,-97.10807,,,,,,
GMU,GMU_7422,2019-05-31 04:58:48,"Mobile Mason: Hey, the power's out in Arlington.",-0.41220033168792725,Arlington,32.73569,-97.10807,,,,,,
GMU,GMU_7423,2019-05-31 04:58:48,"RAVE Guardian: Hey, the power's back on in Arlington.",0.18066653609275818,Arlington,32.73569,-97.10807,,,,,,
GMU,GMU_7424,2019-05-31 04:58:48,"Mason Email: Hey, the power's back on in Arlington.",0.17261166870594025,Arlington,32.73569,-97.10807,,,,,,
GMU,GMU_7425,2019-05-31 04:58:48,"Personal Email: Hey, the power's back on in Arlington.",0.24338684976100922,Arlington,32.73569,-97.10807,,,,,,
GMU,GMU_7426,2019-05-31 04:58:48,"SMS: Hey, the power's back on in Arlington.",0.20464655756950378,Arlington,32.73569,-97.10807,,,,,,
GMU,GMU_7427,2019-05-31 04:58:48,"Mobile Mason: Hey, the power's back on in Arlington.",0.13089054822921753,Arlington,32.73569,-97.10807,,,,,,
GMU,GMU_7441,2019-05-30 23:01:12,"just have an online page where people can have settings for masonalert, checkboxes to enable/disable alerts for the fairfax, prince william, and arlington campuses so we don't have to receive all three if we only go to one or two",-0.004312853328883648,Prince William,45.91681,-67.04889,,,,,,
GMU,GMU_7441,2019-05-30 23:01:12,"just have an online page where people can have settings for masonalert, checkboxes to enable/disable alerts for the fairfax, prince william, and arlington campuses so we don't have to receive all three if we only go to one or two",-0.004312853328883648,Arlington,40.4259,-79.9745,,,,,,
GMU,GMU_7455,2019-02-25 18:21:20,I nearly got blown over on my way to Peterson today.,-0.6644379496574402,West Tarentum,40.59646,-79.77033,,,,,,
GMU,GMU_7517,2019-02-22 14:56:33,same thing happened to me (last semester i think) when someone posted a video recording of some guy walking barefoot in jc.,-0.05894874408841133,Jc Contemporary,41.79959,12.47982,,,,,,
GMU,GMU_7577,2025-09-16 11:37:05,"Yesterday, I got on the West Campus shuttle and there were two guys that probably bathed in cologne rather than showered.",-0.2638082802295685,West Campus,34.67943,-82.8396,,,,,,
GMU,GMU_7606,2025-09-20 10:57:37,"At Old Dominion is the same, most of the students smell like dirty ass, disgusting.",-0.9567427635192871,Virginia,37.54812,-77.44675,,,,,,
GMU,GMU_7729,2021-02-28 19:07:30,It should be all done by the 2022 I believe with the rest of Horizon Hall being built.,0.1591482311487198,Horizon City Town Hall,31.68359,-106.20183,,,,,,
GMU,GMU_7780,2024-09-24 09:03:13,he even brought it to southside  memories,0.15928985178470612,Southside,39.78121,-76.39468,,,,,,
GMU,GMU_7791,2021-01-15 19:24:43,"So, there's a big ass shuttle with a big ass gmu logo on it driving around nova?",-0.21110987663269043,Nova,65.65053,12.65206,,,,,,
GMU,GMU_7856,2019-09-20 20:22:33,"Like who cares if it's GPS tracked, it's at the bottom of Mason pond",-0.3482346534729004,Mason Pond,41.64506,-72.80084,,,,,,
GMU,GMU_7862,2019-09-20 19:21:39,I thought all the buildings in GMU would be handicap accessible,0.0018732105381786823,Greenville Downtown Airport,34.85031,-82.3509,,,,,,
GMU,GMU_7897,2022-03-03 22:03:41,Must be from Miami,-0.0025902139022946358,Miami,25.77427,-80.19366,,,,,,
GMU,GMU_7899,2022-03-04 08:12:31,Gmu parking still gives me ptsd,-0.8833976984024048,Greenville Downtown Airport,34.85031,-82.3509,,,,,,
GMU,GMU_8000,2019-02-26 21:12:05,I saw Chow Hall be shut down and the opening of South Side.,-0.13630494475364685,South Side,41.74855,-87.64417,,,,,,
GMU,GMU_8002,2019-02-26 21:12:05,"During finals we would go to South Side, get a booth, and study and eat for hours.",0.006590863689780235,South Side,41.74855,-87.64417,,,,,,
GMU,GMU_8017,2019-02-26 17:11:14,"There's Robinson, the path from Skyline to the JC, the area near Mason/Buchanan, and the area near the theater building.",0.0012770958710461855,Robinson Crossroads,35.94925,-84.15881,,,,,,
GMU,GMU_8017,2019-02-26 17:11:14,"There's Robinson, the path from Skyline to the JC, the area near Mason/Buchanan, and the area near the theater building.",0.0012770958710461855,Skyline,44.14219,-94.03079,,,,,,
GMU,GMU_8017,2019-02-26 17:11:14,"There's Robinson, the path from Skyline to the JC, the area near Mason/Buchanan, and the area near the theater building.",0.0012770958710461855,Hagik Junction,37.43678,126.65198,,,,,,
GMU,GMU_8022,2019-02-26 13:20:52,"I graduated 2015, but I remember they were starting to force on campus students to buy unlimited plans for Southside/the other buffet place near presidents park.",-0.01545680407434702,Southside,39.78121,-76.39468,,,,,,
GMU,GMU_8022,2019-02-26 13:20:52,"I graduated 2015, but I remember they were starting to force on campus students to buy unlimited plans for Southside/the other buffet place near presidents park.",-0.01545680407434702,Presidents Park,38.89562,-77.03651,,,,,,
GMU,GMU_8028,2019-02-26 20:10:35,"The area around Buchanan was supposed to be down earlier but they ran into problems with subterranean shit, I think",-0.7817157506942749,Buchanan,46.00012,-77.39948,,,,,,
GMU,GMU_8073,2025-01-18 20:59:49,"Meredith Ashley Drottar (‘10), 03/04/1988-01/15/2025 It is with deep sorrow that we announce that our beloved partner, sister, aunt, friend, and Phan, Meredith Ashley “Doc Otter” Drottar stepped through the portal at 6:02 pm January 15 at St. Mary’s Hosptial in Grand Junction.",-0.46801289916038513,Grand Junction,42.4042,-86.07308,,,,,,
GMU,GMU_8076,2025-01-18 20:59:49,"Meredith lived a life out of movie and it started when she was born at home on March 4, 1988 in Leesburg, VA.",0.004042108543217182,Leesburg,39.11566,-77.5636,,,,,,
GMU,GMU_8076,2025-01-18 20:59:49,"Meredith lived a life out of movie and it started when she was born at home on March 4, 1988 in Leesburg, VA.",0.004042108543217182,Virginia,37.54812,-77.44675,,,,,,
GMU,GMU_8077,2025-01-18 20:59:49,"Her adventure really ramped up 5 days laters when the family packed up and moved cross country to Fort Collins, CO. Meredith would spend her entire childhood in Fort Collins and would go on to graduate from Rocky Mountain High School.",0.07970989495515823,Fort Collins,40.58526,-105.08442,,,,,,
GMU,GMU_8077,2025-01-18 20:59:49,"Her adventure really ramped up 5 days laters when the family packed up and moved cross country to Fort Collins, CO. Meredith would spend her entire childhood in Fort Collins and would go on to graduate from Rocky Mountain High School.",0.07970989495515823,Colorado,39.00027,-105.50083,,,,,,
GMU,GMU_8077,2025-01-18 20:59:49,"Her adventure really ramped up 5 days laters when the family packed up and moved cross country to Fort Collins, CO. Meredith would spend her entire childhood in Fort Collins and would go on to graduate from Rocky Mountain High School.",0.07970989495515823,Fort Collins,40.58526,-105.08442,,,,,,
GMU,GMU_8077,2025-01-18 20:59:49,"Her adventure really ramped up 5 days laters when the family packed up and moved cross country to Fort Collins, CO. Meredith would spend her entire childhood in Fort Collins and would go on to graduate from Rocky Mountain High School.",0.07970989495515823,Rocky Mountain High School,44.79634,-108.50651,,,,,,
GMU,GMU_8083,2025-01-18 20:59:49,"She worked for 15 years at Trader Joe’s in stores from Reston, VA to Denver, CO with stops in Albuquerque and Salt Lake City in between, leaving a litany of lasting lifelong friendships.",0.5451258420944214,Reston,43.13011,-123.62008,,,,,,
GMU,GMU_8083,2025-01-18 20:59:49,"She worked for 15 years at Trader Joe’s in stores from Reston, VA to Denver, CO with stops in Albuquerque and Salt Lake City in between, leaving a litany of lasting lifelong friendships.",0.5451258420944214,Virginia,37.54812,-77.44675,,,,,,
